{
  "$schema": "https://json-schema.org/draft/2020-12/schema",
  "$id": "https://vida-agent.invalid/schemas/research-synthesis.v1.schema.json",
  "type": "object",
  "additionalProperties": false,
  "required": [
    "schema",
    "bundle_id",
    "work_item_id",
    "source_revision",
    "scope_id",
    "topic",
    "result_refs",
    "findings",
    "uncertainties",
    "conflicts",
    "br_ids",
    "sr_ids",
    "ac_ids",
    "gap_ids",
    "options",
    "recommendation",
    "completeness",
    "readiness",
    "instruction_activation",
    "actor",
    "pointer",
    "created_at",
    "updated_at",
    "digest"
  ],
  "properties": {
    "$schema": {
      "const": "https://json-schema.org/draft/2020-12/schema"
    },
    "schema": {
      "const": "ResearchSynthesis/v1"
    },
    "bundle_id": {
      "type": "string",
      "pattern": "^[a-z0-9][a-z0-9._-]{0,127}$"
    },
    "work_item_id": {
      "type": "string",
      "minLength": 1,
      "maxLength": 256
    },
    "source_revision": {
      "type": "string",
      "minLength": 1,
      "maxLength": 2048
    },
    "scope_id": {
      "type": "string",
      "minLength": 1,
      "maxLength": 512
    },
    "topic": {
      "type": "string",
      "minLength": 1,
      "maxLength": 512
    },
    "result_refs": {
      "type": "array",
      "description": "Exact predecessor ResearchResult IDs and digests in bytewise ascending result_id order. Their array index defines the rN prefix used by source citations.",
      "minItems": 1,
      "maxItems": 64,
      "uniqueItems": true,
      "items": {
        "type": "object",
        "additionalProperties": false,
        "required": ["result_id", "digest"],
        "properties": {
          "result_id": {
            "type": "string",
            "pattern": "^[a-z0-9][a-z0-9._-]{0,127}$"
          },
          "digest": {
            "type": "string",
            "pattern": "^[a-f0-9]{64}$"
          }
        }
      }
    },
    "findings": {
      "type": "array",
      "maxItems": 128,
      "items": {
        "type": "object",
        "additionalProperties": false,
        "required": ["finding_id", "statement", "source_refs", "evidence_class", "status"],
        "properties": {
          "finding_id": {
            "type": "string",
            "minLength": 1,
            "maxLength": 256
          },
          "statement": {
            "type": "string",
            "minLength": 1,
            "maxLength": 4096
          },
          "source_refs": {
            "type": "array",
            "description": "Qualified rN:<local source_id> keys from the exact result_refs catalog; local IDs alone are not valid synthesis citations.",
            "minItems": 1,
            "maxItems": 64,
            "uniqueItems": true,
            "items": {
              "type": "string",
              "minLength": 1,
              "maxLength": 512
            }
          },
          "evidence_class": {
            "enum": ["Decision", "Code", "Static", "Runtime", "GAP"]
          },
          "status": {
            "enum": ["confirmed", "tentative", "unknown"]
          }
        }
      }
    },
    "uncertainties": {
      "type": "array",
      "maxItems": 64,
      "items": {
        "type": "object",
        "additionalProperties": false,
        "required": ["uncertainty_id", "statement", "material"],
        "properties": {
          "uncertainty_id": {
            "type": "string",
            "minLength": 1,
            "maxLength": 256
          },
          "statement": {
            "type": "string",
            "minLength": 1,
            "maxLength": 4096
          },
          "material": {
            "type": "boolean"
          }
        }
      }
    },
    "conflicts": {
      "type": "array",
      "maxItems": 64,
      "items": {
        "type": "object",
        "additionalProperties": false,
        "required": ["conflict_id", "statement", "source_refs", "status"],
        "properties": {
          "conflict_id": {
            "type": "string",
            "minLength": 1,
            "maxLength": 256
          },
          "statement": {
            "type": "string",
            "minLength": 1,
            "maxLength": 4096
          },
          "source_refs": {
            "type": "array",
            "description": "Qualified rN:<local source_id> keys from the exact result_refs catalog; local IDs alone are not valid synthesis citations.",
            "minItems": 2,
            "maxItems": 64,
            "uniqueItems": true,
            "items": {
              "type": "string",
              "minLength": 1,
              "maxLength": 512
            }
          },
          "status": {
            "enum": ["open", "reconciled", "accepted_unknown"]
          }
        }
      }
    },
    "br_ids": {
      "type": "array",
      "maxItems": 32,
      "uniqueItems": true,
      "items": {
        "type": "string",
        "minLength": 1,
        "maxLength": 512
      }
    },
    "sr_ids": {
      "type": "array",
      "maxItems": 32,
      "uniqueItems": true,
      "items": {
        "type": "string",
        "minLength": 1,
        "maxLength": 512
      }
    },
    "ac_ids": {
      "type": "array",
      "maxItems": 32,
      "uniqueItems": true,
      "items": {
        "type": "string",
        "minLength": 1,
        "maxLength": 512
      }
    },
    "gap_ids": {
      "type": "array",
      "maxItems": 32,
      "uniqueItems": true,
      "items": {
        "type": "string",
        "minLength": 1,
        "maxLength": 512
      }
    },
    "options": {
      "type": "array",
      "minItems": 1,
      "maxItems": 32,
      "items": {
        "type": "object",
        "additionalProperties": false,
        "required": ["option_id", "label", "description", "evidence_refs"],
        "properties": {
          "option_id": {
            "type": "string",
            "pattern": "^[a-z0-9][a-z0-9._-]{0,127}$"
          },
          "label": {
            "type": "string",
            "minLength": 1,
            "maxLength": 256
          },
          "description": {
            "type": "string",
            "minLength": 1,
            "maxLength": 4096
          },
          "evidence_refs": {
            "type": "array",
            "description": "Qualified rN:<local source_id> keys from the exact result_refs catalog.",
            "maxItems": 64,
            "uniqueItems": true,
            "items": {
              "type": "string",
              "minLength": 1,
              "maxLength": 512
            }
          }
        }
      }
    },
    "recommendation": {
      "type": ["object", "null"],
      "additionalProperties": false,
      "required": ["option_id", "rationale", "evidence_refs"],
      "properties": {
        "option_id": {
          "type": "string",
          "pattern": "^[a-z0-9][a-z0-9._-]{0,127}$"
        },
        "rationale": {
          "type": "string",
          "minLength": 1,
          "maxLength": 4096
        },
        "evidence_refs": {
          "type": "array",
          "description": "Qualified rN:<local source_id> keys from the exact result_refs catalog.",
          "maxItems": 64,
          "uniqueItems": true,
          "items": {
            "type": "string",
            "minLength": 1,
            "maxLength": 512
          }
        }
      }
    },
    "completeness": {
      "type": "object",
      "additionalProperties": false,
      "required": [
        "status",
        "required_questions",
        "answered_questions",
        "missing_questions",
        "material_gaps",
        "external_validation"
      ],
      "properties": {
        "status": {
          "enum": ["pass", "blocked"]
        },
        "required_questions": {
          "type": "array",
          "maxItems": 64,
          "uniqueItems": true,
          "items": {
            "type": "string",
            "minLength": 1,
            "maxLength": 4096
          }
        },
        "answered_questions": {
          "type": "array",
          "maxItems": 64,
          "uniqueItems": true,
          "items": {
            "type": "string",
            "minLength": 1,
            "maxLength": 4096
          }
        },
        "missing_questions": {
          "type": "array",
          "maxItems": 64,
          "uniqueItems": true,
          "items": {
            "type": "string",
            "minLength": 1,
            "maxLength": 4096
          }
        },
        "material_gaps": {
          "type": "array",
          "maxItems": 64,
          "uniqueItems": true,
          "items": {
            "type": "string",
            "minLength": 1,
            "maxLength": 512
          }
        },
        "external_validation": {
          "type": "object",
          "additionalProperties": false,
          "required": ["required", "source_count", "minimum_sources", "status", "live_check"],
          "properties": {
            "required": {
              "type": "boolean"
            },
            "source_count": {
              "type": "integer",
              "minimum": 0,
              "maximum": 64
            },
            "minimum_sources": {
              "type": "integer",
              "minimum": 0,
              "maximum": 64
            },
            "status": {
              "enum": ["pass", "blocked", "not_required"]
            },
            "live_check": {
              "type": ["boolean", "null"]
            }
          }
        }
      }
    },
    "readiness": {
      "enum": ["ready", "blocked", "informational"]
    },
    "actor": {
      "type": "string",
      "minLength": 1,
      "maxLength": 256
    },
    "pointer": {
      "type": "string",
      "minLength": 1,
      "maxLength": 512
    },
    "created_at": {
      "type": "string",
      "minLength": 1,
      "pattern": "^(?:(?:(?:\\d{4}-(?:(?:0[13578]|1[02])-(?:0[1-9]|[12]\\d|3[01])|(?:0[469]|11)-(?:0[1-9]|[12]\\d|30)|02-(?:0[1-9]|1\\d|2[0-8])))|(?:(?:\\d{2}(?:0[48]|[2468][048]|[13579][26])|(?:[02468][048]|[13579][26])00))-02-29)T(?:[01]\\d|2[0-3]):[0-5]\\d:[0-5]\\d(?:\\.\\d{1,9})?(?:Z|[+-](?:0\\d|1\\d|2[0-3]):[0-5]\\d)|(?:(?:1972-06-30|1972-12-31|1973-12-31|1974-12-31|1975-12-31|1976-12-31|1977-12-31|1978-12-31|1979-12-31|1981-06-30|1982-06-30|1983-06-30|1985-06-30|1987-12-31|1989-12-31|1990-12-31|1992-06-30|1993-06-30|1994-06-30|1995-12-31|1997-06-30|1998-12-31|2005-12-31|2008-12-31|2012-06-30|2015-06-30|2016-12-31))T23:59:60(?:\\.\\d{1,9})?(?:Z|\\+00:00))$"
    },
    "updated_at": {
      "type": "string",
      "minLength": 1,
      "pattern": "^(?:(?:(?:\\d{4}-(?:(?:0[13578]|1[02])-(?:0[1-9]|[12]\\d|3[01])|(?:0[469]|11)-(?:0[1-9]|[12]\\d|30)|02-(?:0[1-9]|1\\d|2[0-8])))|(?:(?:\\d{2}(?:0[48]|[2468][048]|[13579][26])|(?:[02468][048]|[13579][26])00))-02-29)T(?:[01]\\d|2[0-3]):[0-5]\\d:[0-5]\\d(?:\\.\\d{1,9})?(?:Z|[+-](?:0\\d|1\\d|2[0-3]):[0-5]\\d)|(?:(?:1972-06-30|1972-12-31|1973-12-31|1974-12-31|1975-12-31|1976-12-31|1977-12-31|1978-12-31|1979-12-31|1981-06-30|1982-06-30|1983-06-30|1985-06-30|1987-12-31|1989-12-31|1990-12-31|1992-06-30|1993-06-30|1994-06-30|1995-12-31|1997-06-30|1998-12-31|2005-12-31|2008-12-31|2012-06-30|2015-06-30|2016-12-31))T23:59:60(?:\\.\\d{1,9})?(?:Z|\\+00:00))$"
    },
    "digest": {
      "type": "string",
      "pattern": "^[a-f0-9]{64}$"
    },
    "instruction_activation": {
      "type": "object",
      "additionalProperties": false,
      "required": [
        "use_id",
        "risk",
        "phase",
        "lane",
        "trigger",
        "required_instruction_ids",
        "instruction_ids",
        "registry_digest",
        "source_digests"
      ],
      "properties": {
        "use_id": {
          "type": "string",
          "pattern": "^[a-z0-9][a-z0-9._:-]{0,255}$"
        },
        "risk": {
          "type": "string",
          "enum": ["low", "medium", "high"]
        },
        "phase": {
          "type": "string",
          "minLength": 1,
          "maxLength": 128
        },
        "lane": {
          "type": "string",
          "minLength": 1,
          "maxLength": 128
        },
        "trigger": {
          "enum": ["research_intent", "domain_question", "external_fact", "api_assumption", "provider_change"]
        },
        "required_instruction_ids": {
          "type": "array",
          "minItems": 0,
          "maxItems": 64,
          "uniqueItems": true,
          "items": {
            "type": "string",
            "pattern": "^[a-z0-9][a-z0-9._-]{0,127}$"
          }
        },
        "instruction_ids": {
          "type": "array",
          "minItems": 1,
          "maxItems": 64,
          "uniqueItems": true,
          "items": {
            "type": "string",
            "pattern": "^[a-z0-9][a-z0-9._-]{0,127}$"
          }
        },
        "registry_digest": {
          "type": "string",
          "pattern": "^[a-f0-9]{64}$"
        },
        "source_digests": {
          "type": "array",
          "minItems": 1,
          "maxItems": 64,
          "uniqueItems": true,
          "items": {
            "type": "object",
            "additionalProperties": false,
            "required": ["instruction_id", "source_sha256"],
            "properties": {
              "instruction_id": {
                "type": "string",
                "pattern": "^[a-z0-9][a-z0-9._-]{0,127}$"
              },
              "source_sha256": {
                "type": "string",
                "pattern": "^[a-f0-9]{64}$"
              }
            }
          }
        }
      }
    }
  }
}
